"한투증권 ""1월 중화권 증시 박스권 예상""","英언론 ""미 주도 다국적함대, 예멘 후티반군 거점 폭격 임박""",수원 영통구 8층 건물서 화재…남성 1명 중상,오늘 일교차 커…내일 비오고 3·1절 '꽃샘추위',"정부 ""불법 집단행동 정부 원칙 변함없다…법에 따라 조치""","감사원 ""정부, 미래 기후 예측 부족…침수 등 위험""",2028년부터 경제활동인구·취업자 감소 전망,또 펜웨이 파크에서 홈런 도둑맞은 이정후…보스턴전 무안타,스포츠의류 매장 야외 천막서 방화 추정 불…인명피해는 없어,"최경주, SKT 오픈 정상…한국골프 최고령 우승","이동국, 박주호에 '법적 대응' 시사한 축구협회 비판",[글로벌증시] 경기침체 우려에 뉴욕증시 3대지수 일제히 급락,"LG CNS, 21일 '싱글렉스 라이브' 웨비나…AX 전략 등 발표",잊지 않겠습니다'…전북에 순직 소방관 추모시설 마련,"LS증권, 코웨이 기업 분석 재개…""안정적인 실적 돋보여"""
"부산시, 오페라하우스·콘서트홀 브랜드 이미지 선호도 조사","""작년 말 코로나 감염 증가세…백신 접종 지속해야""",서귀포시 민관협력의원 개원 '원점으로'…운영자 재공모,"앤서니 김, LIV 골프 열리는 코스 연습장에서 '몸풀기 스윙'","지하차도 대피로 확보…부산시, 적극행정 우수 공무원 14명 선발","美 반도체 기업 엔비디아, 차세대 AI 칩 'B100' 공개",[주목! 대전 조례] 임차인 보호 대책과 지원 근거 마련,"美정부 ""美통신사들 중국장비 제거·대체하는 데 4조원 더 필요""","""'마진콜 사태' 빌 황의 아케고스, 하룻밤새 투자금 50% 날렸다""",[마켓뷰] 안도와 불안 사이…엔비디아 실적 기다리는 증시,"알카라스, 조코비치 꺾고 윔블던 테니스 2연패",[AM-PM] 25만원 지원법·이진숙 탄핵안 본회의 표결 外,"""해외증권 투자 붐, 환율 상승 가속화 위험 있다""","중기부, 대구 온누리상품권 부정유통 가맹점 7곳 고발",부산문학관 사업비 290억원 들여 원안대로 건립
"숙취 운전' 40대, 주행 중 앞 차 들이받아","[2보] 美, 북러 탄도미사일 거래 관여 러 기업·개인 제재",바이든의 트럼프 제압 동력이던 젊은층 '변심'…고작 4%p차,"LIV골프로 간 람 ""우즈는 내 문자에 응답도 안했다""","서초구, 초등학교에 '등굣길 안전도우미' 200명 고용 지원","김정은, 초대형방사포 사격훈련 지도…""적 수도 붕괴""",김 수출 늘자 국내 가격 급등…할인 품목에 추가,"머스크, 테슬라 충전인력 해고·충전망 확충 감속 시사","[동정] 함영주 하나금융 회장, '바이바이 플라스틱 챌린지' 참여",서초구 '서리풀 아동·청소년 축제' 25일 개최,[날씨] '초복' 중부 곳곳 폭염…남부는 장맛비 이어져,"유니세프, 북한에 올해 상반기 22억원 상당 의료품 지원",세종시 연동면에 4천500가구 아파트 건설…2029년 말 완공 목표,부산시 '글로벌도시특별법' 160만 서명부 국회 전달,DP월드투어 Q스쿨에서 세계랭킹 1천80위가 꿈의 59타
"대신증권 ""엔씨소프트, 신작 흥행 부진…목표가↓""",예비후보 한달…인천 이재명 지역구 '썰렁'·남동을 '북적',축구 약소국 위한 친선대회 'FIFA 시리즈' 사우디 등지서 개최,"여자축구 벨호, 포르투갈에 1-5 대패…손화연 만회 골",[마켓뷰] 美훈풍·中경기부양 기대…반도체 봄날 오나,경부고속도 판교IC 부근 대형 화물차간 사고…출근시간 정체극심,"""사직서 수리 금지는 직권남용"" 복지부 장·차관 고발","법원 ""이스타항공 정리해고, 부당해고 아냐""","""5·18 왜곡 게임으로 돈까지 벌어""…강경 대응에도 재생산","전병관 멀티골' 전북, 광주 완파하고 꼴찌 탈출","김천, '박진섭 퇴장' 전북 꺾고 선두 탈환…이동경 김천 데뷔골","배드민턴 정나은·김원호, 은메달 확보…치열한 승부에 구토까지",[오늘의 국회일정](8일·목),"충북도 수질 개선 결의대회 개최…""수질 1등급 목표""",[마켓뷰] 빅이벤트 이후 복잡해지는 셈법…상승 재료 찾는 코스피
"NH투자 ""네이버, 올해 AI 통한 주가 상승 기대""","아마존서 2천년전 번성 도시 흔적 발견…""정교한 시스템 구축""","""해병대 창설 처음 제안한 아버지가 '해상인민군'이라니…""","오타니, 다저스 유니폼 입은 첫 경기부터 화끈한 홈런 쇼","[현장연결] 정부 ""불법적인 집단행동 대응 원칙에 변함없어""","도태우 무소속 출마 대구 중남구, 3자 경합 관심지로 급부상","건보공단 노조 ""필수의료 10조 투입시 건보재정 파탄""","서울시, 전국 첫 '학교 밖 늘봄학교' 운영…확대 계획",호실적' 대형주 목표주가 줄상향에 증시 낙관론 솔솔,전국체전 25년 만에 부산서 개최…내년 10월,[이시각헤드라인] 7월 15일 라이브투데이1부,"강남구, 베트남 메디팜엑스포서 '의료관광' 홍보",한국선 전기차 배터리 제조사 '깜깜이'…해외는 공개 의무화 추진,"올해 농식품 수출액 11조 3천억 원… ""역대 최대""",[이시각헤드라인] 11월 11일 라이브투데이1부
"G마켓, 판매자용 데이터 분석 서비스 제공…판매 전략 지원",작년 뎅기열 환자 2배로 늘어…전국 공항서 무료검사 가능,"[MWC] KT, 올해도 아태지역 '모바일 축제' 서울 개최",[부고] 종수(전 조계종 기획실장)스님 모친상,"[3분증시] 뉴욕증시, 이틀 연속 랠리…나스닥 1.14%↑ 外",[현장in] 공영주차장 점령 캠핑카…아라뱃길 '얌체주차' 몸살,"[AM-PM] 정부, '2천명 증원' 의대별 정원 배분 발표 外","[게시판] 세이브더칠드런, 위세이브 3천호점 가입 현판 전달","삼성전자 세탁기 50년…""수고로움을 편리함으로 바꾼 혁신""","[날씨] 낮 기온 껑충, 큰 일교차…중북부 비 조금",남해안 80㎜ 호우…내일 중부 세찬 장맛비,"[날씨] 곳곳 폭염경보, 서울 12일째 열대야…중부 비·남부 소나기","[날씨클릭] 오늘 중부 비, 남부 소나기…찜통더위는 계속",[이시각헤드라인] 11월 6일 라이브투데이1부,"부산시·캠코·BNK, 600억원 규모 지역특화 투자 협약"
"이스라엘 간 獨외무도 저강도전 촉구 ""가자 민간인 보호해야""",뒷돈 주면 의대 합격…수십억 챙긴 컨설턴트 영장,"[MWC] SKT 유영상 ""개인형 AI 비서가 게임체인저…연내 AI DC 시작""",고양 자유로 회전교차로서 25t 트럭 전도…전면 통제,"[게시판] BAT로스만스, 상반기 신입사원 공개 채용 실시",브라질 중남부 열돔현상…체감온도 62.3℃,"前 美합참의장, 아프간 혼란 바이든 정부 직격…""철수결정 늦어""",박목월 미발표 육필 시 디지털북으로 제작,AI로 안부 확인하고 건강·안전 관리…삼성전자 '패밀리 케어',"""대학로에 놀러오세요""…종로구 25일 '차없는 거리' 행사","""IP 보유 제작사 해외 진출 지원""…26일까지 참가사 공모","도로 건너던 60대 여성, 음주 차량에 치여 사망","박태준, 남자 태권도 58kg 금메달…16년 만의 경사","""2050년 독거노인 4명 중 1명 치매 의심""","""트럼프, 더 위험한…다루기 어려운 김정은 마주할 것"""
"서울 강서구, '평일밤·주말 진료' 소아 의원 운영",신임 주한 일본대사에 미즈시마 주이스라엘 대사 내정,"[MWC] 삼성전자 ""갤럭시 링 하반기면 출시할 듯…큰 기대""","[마켓뷰] ""불안하네…"" 금융·자동차株 배당락 주목",부산오페라하우스 발레단 단원 공개 모집,가자지구 최남단 지상전 두고 바이든-네타냐후 이견,산좋고 물좋은 경북·강원·충북지역 산불에는 '취약',"USGA ""자격만 갖추면 LIV 골프 선수 US오픈 출전 환영""",삼천포고의 '특별한 수학여행'…30년 만에 뭉친 담임·졸업생,"""올여름 무덥다""…오늘부터 온열질환 감시체계 운영",지구를 구하는 나만의 여행'…굿네이버스 온라인 사진전,"[올림픽] 근대5종 전웅태, 사전캠프서 미역국·'깜짝 파티'로 생일맞이","[올림픽] 한국 태권도의 '한 페이지'를 쓴 박태준 ""금메달 위해 살아왔다""","방통위, TBS 정관변경 신청 또 반려…""의결 사안""",일본 '총리지명 선거' 특별국회…이시바 재선출 유력
"부산 가구당 한달 사교육비 60만원…64.3% ""교육비 부담된다""","한일경제단체, 스타트업 육성 협력 강화 합의",[주요 신문 사설](27일 조간),춘천서 주택 화재로 80대 숨져,"한투증권 ""3월 코스피 등락 범위 2,550∼2,750""","뉴욕증시, 기술주 강세에 상승…나스닥 0.8%↑",일제시대 경성서 펼쳐지는 비극적 사랑…오페라 '라 트라비아타',"시리아 ""이스라엘이 한밤중 수도 주변 공습…군인 8명 부상""",무면허 운전 처벌받고 또…교통사고에 도주까지 한 50대 실형,서울 범죄 발생은 줄었지만…시민 불안 정도는 커져,[주요 신문 사설](15일 조간),[베스트셀러] 휴가철엔 장르소설…히가시노 게이고 신작 1위,의정부 복합문화융합단지 기반 시설 공사 내달 마무리,"군 무인정찰기, 정찰임무 수행 후 복귀 도중 추락",서초구 '아·태 사법정의 허브' 학술대회 연다
"SSG닷컴, 글로벌 럭셔리 플랫폼 '네타포르테' 브랜드관 개설","금감원·경찰청·건보공단, 보험사기 척결 협력 강화",[전국 주요 신문 톱뉴스](27일 조간),"[MWC] KT 김영섭 ""AICT 회사로 전환…글로벌 파트너와 멀티LLM""","[부산소식] 부산시, 초고령사회 대응 '건강업 심포지엄'",[날씨] 꽃샘추위 속 전국 눈·비…강원산지 많은 눈 주의,"뉴욕증시, FOMC 회의 앞두고 상승…다우 0.8%↑",어선 위치발신장치 끄면 징역형…구명조끼 의무화,늘어나는 중장년 1인 가구…요리로 식생활 개선·고립감 해소,강릉서 뺑소니 의심 사고로 20대 숨져…40대 용의자 조사,[전국 주요 신문 톱뉴스](15일 조간),"[게시판] KCOC, 2024 하반기 회원단체 역량강화 프로그램 운영","양희영, 여자 골프 1라운드 공동 13위…부티에 선두",북한 쓰레기 풍선 화재 김포 공장…2개월 넘게 복구 난항,"MLB 신시내티, 홈구장서 14시간 동안 피트 로즈 추모 행사"
"애경산업, 탈모 증상 완화 '맥주효모 샴푸' 출시","중국 ""'하나의 중국' 기초로 무역제재 협상 가능""","플레잉코치 정우람 ""류현진과 1군서 만나자는 약속 지키고 싶어""",[주요 신문 사설](28일 조간),관악S밸리 창업공간 입주기업 8곳 선정…경쟁률 13대1,멕시코 '에너지 국영기업 우선 기조' 지속될 가능성 커져,2월에도 방일 외국인 중 한국인 최다…81만명,"애플, 역대 최대 1천100억달러 자사주 매입…시간외 주가 6%↑(종합2보)",[여행honey] 도솔천을 걷다…선운사와 도솔산,"스타벅스, 매달 '럭키스타 케이크' 출시…""별자리 탄생석 표현""","尹 지지율, 소폭 상승한 32.3％…국민의힘 38％, 민주당 35％[리얼미터]",[주요 신문 사설](2일 조간),"""트럼프 때 경제바닥""·""해리스 물가 급등""…美대선 경합주 격전",부산추모공원 봉안시설 5만기 확충…'장사 대란' 해소 기대,부산 청년 창업·주거시설 3호점 개소…동의대 기숙사 리모델링
"""어린이복합문화공간 '부산시청 들락날락' 미디어아트 보세요""","삼성가 세 모녀, 지분 2.8조원 블록딜…상속세 납부용","성남시, '종합운동장·중원구청 복합개발' 기본구상 용역 착수",[전국 주요 신문 톱뉴스](28일 조간),"삼성증권 ""CJ, 지주회사 중 유일한 배당 서프라이즈…목표가↑""",[게시판] 군필자에 혜택 '히어로즈 카드' 7월 출시,반역시 종신형' 홍콩판 국가보안법 통과…미국은 비판,[스포츠영상] 시카고 컵스 이안 햅의 호수비,일상 스며든 스포츠 유니폼…'블록코어' 패션 뜬다,김해 공장서 황화수소 누출 소동…알고 보니 부취제 유출,자료 임의수정' 前 서울교육감 후보 캠프 관계자 1심서 징역형,[전국 주요 신문 톱뉴스](2일 조간),"ISS에 발 묶인 보잉 우주선 비행사들, 스페이스X 타고 귀환 검토","경남도소청위, 당사자 동의 없는 통영시의회 인사 교류는 '위법'",[팩트체크] '저마다 제각각'…집회 산정 인원 누가 맞나?
"신세계인터내셔날, 반려동물 카테고리 강화…고가제품도 인기","전동킥보드 음주운전 30대, 횡단보도서 차량에 치여 부상","세이브더칠드런 ""외국인 아동 출생등록제 미룰 수 없어""",[신간] 역사정정사무소·초대받은 여자,"불합리 개선·소통 강화' 양구군, 조직문화 혁신 나선다",[연합뉴스 이 시각 헤드라인] - 07:30,"북 ""신형 중장거리극초음속미사일 고체연료엔진 지상시험 성공""",[이시각헤드라인] 5월 3일 라이브투데이1부,이륜차 교통사고 10대·70대 사망자 절반이 안전모 안 써,"신세계I&C, E1 파트너 시스템 재구축 계약 체결",[여행honey] 더울수록 마카오로 가야 하는 이유,전기차 화재 한번에 도심 아파트 '아수라장'…위험성 현실화,"제주 북부 33일째 열대야…""당분간 지속""",미 대선 투표 진행중…예측불허 접전 속 승리 자신,"[3분증시] 미 증시, 트럼프 랠리 지속…코스피는 충격 완화할까"
서울 -10.3도' 월요일 출근길 강추위…낮에도 5도 이하,"[스포츠영상] 긴 팔로 쓱 리바운드…웸반야마, NBA 데뷔 첫 트리플더블","[마켓뷰] ""어쩌면 오히려 좋을지도"" 실망감 속 피어오르는 밸류업 기대",자폐가 이끈 인류의 진보…신간 '패턴 시커',"""전국구 관광도시로 도약""…원주시, 강원관광재단과 머리 맞댔다","법무부, 고검장 간담회…수사 신속화 방안 논의",부산 남구 '오륙도 트램' 사업 두고 여야 후보 온도차,"이라크 이슬람조직, 이스라엘에 미사일 공격","유튜브에 학교생활 올리고, 운동장에 캠프 설치하는 교사들","보행 힘든 발달장애 청년, 엄마의 그림 속에선 '어린왕자'",제주 차귀도 해상서 어선 침수…승선원 10명 전원 대피,"[신간] 68년 전 북한을 뒤흔든 투쟁…'예고된 쿠데타, 8월 종파사건'","[올림픽] ""北선수단, 삼성 스마트폰 수령""…대북제재 위반 가능성","디와이디, 120억원 3자배정 유상증자 결정",프로배구 KB손보 새판짜기…흥국생명은 무패행진 도전
[날씨] 출근길 -10'C↓ 강추위…곳곳 한파주의보,"부산 공영농산물도매시장, 역대 최대 1조1천301억원 거래 실적","MS, 10개월된 '유럽판' 오픈AI에 투자…""파트너십 체결""(종합)",부산세계탁구선수권대회 흥행 성공…10일간 누적 관중 3만명,부산 선박·해상낚시터에 드론 배송 실증사업 추진,"박정훈 해병 전 수사단장, 군검사 고소…""허위사실로 영장 청구""","서해5도 접경지 어업지도 주체는…옹진군, 유권해석 요청","이재용, 유럽 출장 마치고 귀국…""봄이 왔네요""",킨텍스서 아동 연상 음란물 게시 관계자들 음화반포죄로 입건,"김호중 음주운전 인정…""한순간의 잘못된 판단""",서울 동대문구 아파트서 화재…130여 명 대피,"형제복지원 국가배상 선고 이어져…""6명에 14억4천만원 배상""",[영상구성] 입추 무색한 찜통더위,한미 원자력 수출 협력 강화…체코 원전도 청신호?,"""나 물개 수신! 기다려라""…우크라, 북한군 암호 감청 공개"
[출근길 인터뷰] 아이들에게 따뜻한 한끼…'선한영향력가게'를 아시나요,[이시각헤드라인] 1월 12일 라이브투데이1부,"[3분증시] 뉴욕증시, 연준 선호 물가 대기하며 약세…다우 0.16%↓ 外","[3분증시] 뉴욕증시, 주요 지표 앞두고 혼조…다우 0.25%↓ 外",[날씨] 출근길 공기질 '나쁨'…곳곳 짙은 안개 주의,"윤대통령, 블링컨 접견…""더 나은 민주주의 협력""",[연합뉴스 이 시각 헤드라인] - 07:30,해동검도 관장 아빠 따라 이민' 남아공서 치과의사된 송채은씨,"매킬로이, 결혼 7년 만에 이혼 소송 제기","부산시, 아시아 창업 엑스포 혁신기업 모집…상금 2억5천만원","파주서 신호무시 마을버스, 오토바이 들이받아 2명 사상","권태엽 한국노인복지중앙회장 ""요양시설 종사자 처우 개선해야""","바이든 ""트럼프, 대선패배 시 평화로운 정권이양 확신없어""",민감한 개인정보 불법수집·활용 메타에 과징금 200억,"이영준 시즌 2호 도움' 그라스호퍼, 장크트갈렌에 1-2 패배"
[이시각헤드라인] 1월 8일 라이브투데이2부,[베스트셀러] '마흔에 읽는 쇼펜하우어' 다시 1위로,"부산시, 해빙기 안전사고 대비 취약시설 1천328곳 안전 점검",선불형 동백패스 3월 도입…저신용자·청소년·외국인도 혜택,"[부산소식] 부산시, 리빙랩 실증사업화 지원사업 기업 모집",지난해 개인 해외투자 사상 최대…고위험 종목 쏠림 우려,"미 공군 ""공중발사 극초음속무기 성공적으로 시험""",[부고] 김문관(조선비즈 생활경제부장)씨 부친상,요가·스포츠·농업 한자리에' 선샤인밀양테마파크 인기,방송·웹툰·게임 등 한자리에…부산콘텐츠마켓 22일 개막,경남 진주서 승용차 인도로 돌진…2명 부상,"[걷고 싶은 길] '단원의 도시' 안산, 김홍도 테마길",권도형 한국행 또 불발되나…몬테네그로 검찰 이의제기,"경찰, '제3자 뇌물수수 혐의' 정장선 평택시장 송치","신한투자 ""한국콜마, 3분기 실적 기대 이하…목표가↓"""
[부산소식] 부산시정 홍보 사진 무료 제공,[주요 신문 사설](12일 조간),"보훈장관, '3·1운동 민족대표 33인' 한용운 선생 자녀 위문","[신간] 지구얼굴 바꾼 인종주의·필사의 수컷, 도도한 암컷","한화푸드테크, 미국 로봇 피자 브랜드 스텔라피자 인수","경찰, 의협의 '용산 지침 수사' 주장에 ""비동의·유감""",[날씨] 절기 춘분 꽃샘추위…동쪽 지역 중심 비·눈,"하이브-민희진 싸움에 BTS 음해까지…뿔난 아미 ""가수 보호하라""",범죄도시 4' 1천만명 돌파…한국영화 시리즈 첫 '트리플 천만',건설경기 침체에…1분기 건설자재 출하량 감소,음주운전하다 고가교서 차량 추락…도주한 운전자 검거,"[2보] 7월 소비자물가 2.6% 상승…석유류, 21개월만 최대 상승","싸늘한 민심에 앞다퉈 ""민생""…'협의체' 논의 진행될까",카카오뱅크 3분기 순익 1천242억원 '역대 최대'…작년比 30%↑,[출근길 인터뷰] 2세 계획 중이라면…'이런 약' 주의하세요
"서울 체감 ­15도, 강풍에 더 추워…내륙 한파 특보",[전국 주요 신문 톱뉴스](12일 조간),PGA 투어 코그니전트 클래식 29일 개막…임성재·김주형 등 출격,전세포비아'에 전세가율 80% 넘는 서울빌라 거래 28%로 '뚝',"공천 배제' 임종석 ""당 결정 수용""…민주당 남기로(종합)",차 빼다가 아파트 주차장서 음주운전한 경찰관,올해 1~2월 불법 정당현수막 1만 3천여개 철거,[베스트셀러] 어린이날 앞두고 '흔한남매 16' 1위로 진입,"울산교육청, '학생 맞춤형 체력 향상 프로그램' 20개교서 운영","박현경, 이예원 꺾고 두산 매치플레이 우승","서초구, 가나 학생 초청 교육교류…3개교서 수업·체험","강북구, '환경미화원 휴가'로 쓰레기수거 일시 중단",국민의힘 '사기탄핵 TF' 발족…'옥새공작' 제보자 면담,국방부 홈페이지에 디도스 공격 발생…합참도 접속 불안정,"소진공, 10개 부문에 업무 자동화 추가 적용"
"[CES 2024] 삼성전자 ""AI용 최첨단 메모리 솔루션 대거 공개""","부산시, 버스서 쓰러진 20대 살린 운전기사에 감사패","하나증권, 하이브 목표가 내려…""앨범 성장 둔화""",무역협회 상근부회장에 이인호 무역보험공사 사장,"[출근길 인터뷰] ""DMZ 걸으며 봄기운 만끽해요""…임진강변 생태탐방로 재개","최상목 ""물가 상황 엄중…투자활성화 대책 속히 마련""","바이든이냐 트럼프냐…""누가 돼도 자국 우선주의""",[주요 신문 사설](3일 조간),4천만 관객 모은 '범죄도시' 시리즈…8편까지 순항할까,"[게시판] CJ푸드빌, 미국 푸드페스티벌 '푸디랜드' 참가","박형준, 민선8기 후반기 첫 간부회의서 시정혁신·성과창출 강조",[이시각헤드라인] 8월 2일 라이브투데이1부,차기 검찰총장 후보 4명으로 압축…이달 중 임명 제청,고속도로서 음주운전 차가 고장으로 멈춘 차량 추돌…1명 사망,"미래에셋 ""KT, 호실적에 밸류업도 주목…목표가↑"""
[박스오피스] '위시'에 밀린 '노량' 흥행 적신호,[CES 현장] 미래 애플·구글 꿈꾼다…스타트업 집결 유레카파크 '후끈',스타필드 안성서 번지점프 추락 사고…1명 사망,"부산시, 전기자동차 보조금 확대…상반기 4천880대 지원","정부 ""불법 집단행동 오늘부터 법 따라 조치…망설임 없이 이행""(종합)","제주맥주, 100억원 3자배정 유상증자 결정","검찰, '마약 취해 카페서 난동' 작곡가 구속기소",[전국 주요 신문 톱뉴스](3일 조간),"여야 지도부, 조계사 법요식 나란히 참석해 불심잡기",서울대공원 국내 유일 몽골야생말 '용보' 폐사,화성 아리셀 사고로 숨진 근로자 오늘 5명 발인…장례 총 8명,[주말극장가] 조정석 '파일럿' 첫 주말 본격 흥행몰이,[연합뉴스 이 시각 헤드라인] - 07:30,"""인앱결제 美법원 집단조정, 소비자 위한 것…대기업 나서야""","[알면좋은뉴스] 배춧값 내림세…정부 ""김장 재료 최대 40% 할인"" 外"
[인사] 대한상공회의소,"태영건설 채권단, 워크아웃 개시 96.1% 동의","""흉기 위협받고 있다"" 112 허위신고 뒤 경찰에 흉기 휘둘러","부산시 특사경, 수입 농수산물 원산지 둔갑 행위 특별단속",[이시각헤드라인] 3월 4일 라이브투데이2부,이정후 허벅지 근육통 20일 재검진…라인업 복귀 타진,드라마 제작사 고가 인수' 카카오엔터 대표 구속영장 재청구,"중기부, 제조업 소공인 1천452곳 자동화·스마트기술 도입 지원",오늘 '세종대왕 나신 날'…46개국 유학생 한글 실력 겨룬다,"대신증권 ""하나투어 가파른 실적 개선…대주주 매각 우려 과도""","[트럼프 피격] ""50대 의용소방대장, 가족 지키려 몸 던져 희생""(종합2보)","찾아가는 금융상담…부산시, 취약계층 '안녕한 상담실' 확대",시대를 초월하는 지혜와 통찰…'역사'를 공부하는 이유는,필리핀서 K-콘텐츠 불법 IPTV 운영자 검거…경찰·문체부 공조,수능 D-3…경찰 경호 속 문답지 시험지구에 배부
"거제서 유해조수 구제 나선 엽사, 멧돼지 공격으로 숨져","전주 덕진구 마트에서 불…소방 ""인명 피해는 없어""","김남길-서경덕, 삼일절 맞아 '독도 지킴이' 삽살개 알린다","위니아, 뚜껑형 김치냉장고 생산 재개…""M&A 청신호""","하이투자 ""티웨이항공 올해 영업익 1천750억…기존 대비 32%↑""",조국혁신당 비례 순번 확정…1번 박은정·2번 조국,부산서 설 연휴 친할머니 찾아가 살해한 남매 기소,"전북도지사 관사, 53년 만에 개방…'복합문화공간'으로 새단장","285억원 들인 다대포 연안정비사업, 어업보상에 '발목'",인천서 연쇄 교통사고로 차량 9대 파손…8명 부상,투수 - 포수 사인 교환 기기 '피치컴' 16일 도입,영국 기준금리 연 5%로 인하…팬데믹 이후 처음,"""10년간 지하주차장 화재 1천399건…車화재 53% 전기요인""",노동자 여가 보장' 여가친화 기업·기관 168곳 선정,"KB증권 ""CJ대한통운, 직구 물량 증가 제한…목표가↓"""
