"임성재, PGA 투어 '72홀 최다 버디' 신기록 34개…개막전 5위","코스피, 8거래일 연속 내림세…외인 매도 우위(종합)",용리단길에 공공주차장 200면 생긴다…용산구·한전 맞손,"부산항만공사·기업은행, 200억원 규모 상생펀드 연장","[게시판] NH농협카드, 농축산물 소비 촉진 위한 '상생페스티벌'","수출입은행, 기업들에 EDCF 중기운용방향 소개","서울 강서구, 공원·둘레길에 보안관 18명 배치 순찰강화","영등포구 ""퇴원 환자 돌봄 서비스 제공합니다""","이재명, 부처님오신날에 ""적대·반목 극복하고 민생의 길 정진""",[게시판] E1 유튜브 채널 '오렌지테레비' 구독자 10만명 달성,"원/달러 환율, 장초반 보합권…1,377.0원 출발","[올림픽] IOC, XY염색체 여자 복싱선수 논란에 ""여권 기준으로 성별 결정""",[사건사고] 음주 측정 거부 차량에 결혼 앞둔 환경미화원 참변 外,"[게시판] 삼성화재, 삼성서울병원과 암극복 토크콘서트",[당진소식] 우수 평생학습도시 선정돼 교육부장관상 수상
음주·무면허 운전 반복한 60대…4번째 만에 징역 2년,"제주항공, '육아휴직 후 복직' 지원 프로그램…복직률 93%","[게시판] KT 키즈랜드, 더현대 서울에 핑크퐁 한글 놀이터 팝업","[게시판] 기보, 녹색금융·보험 부문 금융위원장상 받아","NHN에듀, 메타버스 학습 플랫폼 '원더버스' 정식 출시","코스피, 1%대 낙폭 확대 2,650대 후퇴…코스닥도 내려(종합)","""스타필드에서는 마음껏 그려봐""…초대형 낙서 구역 공개",평택 부두서 10만t급 선박 접안 작업하던 40대 필리핀인 추락사,충남도 내달 '충남술 톱텐 품평회'…우수 전통주 찾아낸다,[날씨] 전국 맑고 큰 일교차…낮부터 기온 올라,"생명연, OECD와 간 오가노이드 기반 독성시험법 개발",[제주소식] 밤하늘 천체관측 테마 '제주별빛이야기',김대중 전 대통령 생가' 전남도 문화유산 지정,"스타벅스, 장애인 치과 수술비 기금 1억원 전달","GC녹십자, MSCI ESG평가 'A등급' 획득"
소설가의 인생을 건 마지막 작품…뮤지컬 '이프아이월유' 초연,"젤렌스키 ""러시아, 북한서 탄약 100만발 받아""","美당국자 ""韓, 러 방어 위해 우크라에 국방물자 더 지원하기를""","코바코, 통계품질진단 6년 연속 최고 등급","삼성물산, '아시아 디자인 프라이즈' 4년 연속 수상","유비벨록스, 주당 1.0주 무상증자 결정",우리 땅' 독도 향한 열정과 의지…세 차례 학술조사가 남긴 것,1004섬 신안군 기념우표' 발행…전국 우체국 판매,[부고] 전용준(광남일보 대표이사·회장)씨 장인상,"EV6, 독일 전문지 전기차 비교평가서 폭스바겐 ID.5 제쳐",홍해 사태' EU행 해상 수출비 44.6%↑…두달째 상승세,"9월부터 경복궁 근정전 관람 일부 제한된다…""석조물 손상 우려""",태안 동부시장서 매주 토요일 맥주축제 열린다,"현대로템, 대장홍대선 철도 신호시스템 사업 수주","트럼프, 독일 숄츠 총리와 통화…""유럽 평화복원 위해 협력"""
상시 혼잡' 광주 광천사거리 주변 교통환경 개선 공사 완료,"정부 ""수출 중심으로 경기 회복조짐 점차 확대…소비 둔화 우려""","무안공항, 동남아 3개국 '무사증 입국' 내년 3월까지 연장","현대홈쇼핑, 물류창고서 라이브방송…최대 90% 할인","윤재옥 ""더불어민주연합, 종북세력·괴담선동세력 트로이목마""","BC카드, 외국인 특화 '트립패스 카드' 출시","사우디 'AI 큰손' 급부상…""54조원 통큰 투자 계획""",[게시판] 롯데글로벌로지스 '중고 장난감 수거·기부' 행사,"구미시, 반려동물 문화공원 조성 ""보호·입양·놀이 한 곳에서""","[게시판] 에쓰오일, 마포지역 장애인과 아동시설 벽화 그리기","신한카드, 일상생활 적립혜택 더한 '쏠트래블 신용카드' 출시","경기주택도시공사, 연천BIX 산업시설용지 13필지 공급","경기도, 행안부와 하천·계곡 안전관리 현장 점검","용인시, 수능 종합지원대책 마련…소음‧교통‧기상‧수도 분야","삼척시, 우수 평생학습도시 재선정…""평생학습 인프라 확충"""
"김정은, 신축 닭공장 시찰…딸 주애 민생 현장 동행","[게시판] 코오롱, '무지개 디딤돌 멘토링' 8기 해단식","간편 전자세금계산서 서비스 볼타, 모바일 웹 출시","이정후, 메이저리그 시범경기 첫 출전…첫 타석 안타",청주 휴암동 주민들 '지원금 감액'에 소각장 출입구 막아,"[여행소식] 스위스관광청 ""스위스는 한국인 만족도 1위 여행지""","식약처, 펜타닐 패치 과다처방 등 의심 병의원 21곳 점검","尹, 민정수석에 김주현 내정…다음주 인선 발표 전망",구글 검색 이젠 생성형 AI가 해준다…AI 어시스턴트도 공개(종합),"코스피, 장 초반 상승세 2,750대 회복…반도체·저PBR주 강세(종합)",7월의 정원식물 '노루오줌'…여름철 적합,"""확실하게 보여주자"" SNS에 폭주족 집결 유도 글 올린 10대 송치","[게시판] 롯데멤버스 와인클럽, 'K디자인어워드' 수상","""11월11일에는 가래떡 드세요"" 농진청, 가래떡데이 온라인 행사",대구·경북 3분기 광공업 생산·건설수주·수출↑
미 기준금리 불확실성 속 새해 신흥국 채권 발행 '사상 최대',"[CES 2024] '올레드 1위' LG전자, 올레드·QNED '듀얼 트랙'으로 간다",[출근길 인터뷰] 서울서 출산하면 '산후조리비' 100만원 받는다,"가스공, 발전사들과 연 83만t 개별요금 공급 합의","""공부 재미지지만""…뒤늦게 글 배운 어르신들의 시화집","작년 16% 위축된 아태 PC 시장, 올해도 부진…내년엔 8% 반등","독립기념관, 시각·발달장애 학생 위한 특성화 교육","천안시, 사회복지시설 종사자 처우개선 확대…상해보험도 지원","尹 ""늘 부처님 마음 새기면서 올바른 국정 펼치겠다""(종합)","식약처, 건강먹거리 사업 운영 편의점 167개로 확대","베스핀글로벌, 데이터AI 본부 신설…""AI 중심 사업구조 재편""",주차장서 1ｍ 만취 운전한 국립대 교수…2심도 벌금형,[게시판] 유니세프 한국위원회 '모든 어린이를 위해' 30주년 사진전,"아송인베스트-식스티헤르츠, 베트남 재생에너지 협력 업무협약","""퀀텀닷 소재 없는 QLED TV""…한솔케미칼, 공정위에 中 TCL 제소"
"천안시, 고병원성 AI 확산 방지 나서…방역 강화","대전시, AI '돌봄 로봇'으로 노인 고독사 막는다",일본 1월 소비자물가 상승률 2%…20개월 만에 최저,전북 초·중·고교생에 입학금·학습비·진로비 지원,"대우건설, 독립유공자 후손 집짓기에 2억원 후원","삼성전기, 전기차용 고압 MLCC 개발…전장 라인업 확대",인천에 항공 연계 크루즈 추가 입항…관광객 4천400명 규모,"현대차, 美 캘리포니아와 손잡고 수소전기트럭사업 본격화","[현장연결] 윤대통령, 부처님오신날 법요식 참석…""국민행복 키울 것""","""기차 타고 보령 여행""…24일부터 서해금빛 기차관광 운영",2024 제네시스 스코티시 오픈' 성료,"""러시아 인질외교 승리""…미국 풀어준 암살범은 '푸틴의 애국자'",카카오 2분기 영업익 작년보다 18.5%↑…'톡비즈' 호조(종합),"LS일렉트릭, '빅스포 2024' 참가…초전도 설루션 선봬","한동훈 ""李 선거법 위반, 유죄사안…사법부, 법대로 판단해달라"""
촬영소품 방치 제주 '몸살'…오름에 정체모를 흰 물질,"합참의장, 태안 군부대 방문…측·후방 경계태세 점검","코스피, 이틀째 하락 2,630대 후퇴…""저PBR 테마 소강""(종합)",미국이 거듭 '우크라이나 파병' 선긋는 이유는,"한동훈 ""北 한정된 간첩죄 모든 나라로 넓혀야…김영주도 발의""",[그래픽] 4대 은행 직원 1인당 평균 급여 현황,"4대 과학기술원, 인재 양성 역할 분담 체계 만든다","경기도, 2026년까지 95억 들여 화성 매향·안산 풍도항 시설개선",동대문 폐기물처리시설 화재…용두역 4번 출구 폐쇄,"""추락 이란 대통령 헬기 탑승자 총 9명…잔해추정 열원 발견""",영풍제지 주가조작 가담한 자금책 1명 추가 구속,與 정책위의장에 TK중진 김상훈…지명직 최고위원에 원외 김종혁,"SK플래닛, 일본 '로열티 마케팅'과 OK캐쉬백 글로벌화 추진","세이브더칠드런, '기후위기 고민' 국회 대담 참여자 모집","양구군, 농산물 최저가격 지원 대상 품목 및 가격 확정"
철원 등 강원 6곳 한파주의보 해제,"미·영, '홍해 위협' 예멘반군 후티 근거지 공습 개시","與 박민식, 영등포을 경선 포기…박용찬 단수공천 전망","오타니, LA 다저스 데뷔전에서 투런 홈런 기록",등록외국인만 2만여명…김해시 외국인·다문화가족 각별한 지원,"""학생 안전 지키자"" 세종교육청, 교육환경 보호구역 점검 강화","24시간 구민안전 지킨다'…강동구, 재난안전종합상황실 운영",충북 청주에 건조주의보,"뺑소니 혐의' 김호중…""공연 일정 변동 없다""","창원시, 공무원 초과근무 복무관리 강화…QR코드 인증 도입","관세청, 휴가철 맞아 내달 11일까지 휴대품 집중단속","KT ""양양 호텔 '웨이블런트'에 AX 서비스 공급""",일본 상반기 경상흑자 119조원…17개월 연속 흑자,"태안군 올해 첫 운영 들개포획단, 201마리 포획",다시 푸를 청(靑)' 강원도 산림박물관 식물 세밀화전 개최
"오픈엣지, 품질경영 국제표준 ISO 인증 취득",[부고] 홍용표(한양대 교수·전 통일부장관)씨 부친상,푸틴 '우크라 침공' 자업자득…나토 확장에 현대화까지 급물살,인천 옹진군 해상서 50대 어선 선장 실종…해경 수색 중,"태안군, 다음 달까지 기본형 공익직불금 방문신청 접수",창원 9개 시내버스 노사 임금협상 타결…시급 4.48％ 인상,"한미글로벌디앤아이, 시니어 주택 브랜드 '심포니아' BI 공개","""한반도의 미래, 남북 자유로운 왕래 가능한 2국가 검토해야""",알록달록 핀 작약꽃의 향연…임실 붕어섬 생태공원,[그래픽] 손흥민 EPL 3번째 10-10 달성,"충남도, 석유화학제조업체 근로자 처우 개선 사업 추진",대구·경북 7월 소비자물가 2% 이상 상승,"[핫클릭] 인도 레슬링 선수, 결승전서 체중 '150ｇ' 초과해 실격 外","SGC E&C, 내년 상반기 신입사원 공채…""해외근무할 인재 대환영""","나이는 숫자'…67세 랑거, PGA 시니어 최종전 우승"
민주 총선 인재영입 6호는 황정아 천문연구원 책임연구원,"신한투자 ""은행 4분기 실적 부진할듯…충당금·상생금융 비용↑""","""현대차그룹은 어떻게 '빅3'가 됐나""…美 CNBC, 성장스토리 조명",보은 창리에 청년 농촌 보금자리 28가구 건립,"김진호 조선대병원장 취임 ""어려운 의료계 상황에 책임감""","금천구, 어린이보호구역에 통합안전 스마트폴 설치한다","[게시판] KT, 온라인 요금제 '요고' 카톡 이모티콘 무료 배포",서울 서남·서북권에 건조주의보,"[날씨] 부처님 오신 날, 오후 전국 돌풍·벼락 동반 요란한 비","조태열 ""대통령실 컨트롤타워로 경제안보 통합전략 그려야""",시흥오이도박물관에서 내달 말까지 이색 무료 마술공연,"고양시, 거점형 스마트시티 조성…8개 서비스 추진","뉴욕증시, 불확실성 지속에 약세 마감…나스닥 1.05%↓",국제투자 사칭 캄보디아 리딩방 기소…투자유혹 '돼지도살' 사기,엔씨소프트 희망퇴직 접수 완료…신청자 500명 넘어
동네 쓰레기는 스스로 해결…경남형 '자원순환마을' 공모,"""청년의 삶 윤택해지도록"" 동해시, 청년정책에 448억 투입","시지바이오, 이노시스 지분 인수 완료…최대주주 올라","[날씨] 하루 새 큰 일교차…내일 충청 이남 비, 주 후반 꽃샘추위","경기도, '농어민기회소득' 4분기 도입 추진…정책 공론화 병행",인천경제청 올해 외국인 투자유치 강화…6억달러 목표,"[게시판] 신한카드 SOL트래블 체크, 출시 한달 만에 30만 돌파","SKC 1분기 영업손실 762억원으로 적자 확대…""예견된 성장통""(종합)","김정은, 근거리미사일 점검…러시아 수출 무기 다변화에 전력(종합2보)","대전시, 안산국방산업단지 토지거래허가구역 재지정",[인사] 전북 남원시,美고용시장 냉각되니…'팬데믹 후 정상화 vs 경기침체' 논쟁,"""해외서 유심 분실 걱정마세요""…KT, e심 전환 개통 서비스","성남시장, '스페인 스마트시티엑스포' 디지털격차 해소사례 발표","통합위, 15일 '여성과 함께 만드는 미래' 콘퍼런스 개최"
엑스포넨셜자산운용 유상증자…자기자본 103억으로 확충,"태영건설 ""자구안 성실이행…워크아웃 조기마무리해 피해최소화""","미, 중국 여객기 취항 허용 편수 주당 50편으로 확대","양돈장 화재 2월에만 4건…제주도, 노후시설 긴급 안전 점검","티몬·위메프·인터파크, LG모니터 기획전…최대 34% 할인",의정부 맑은물사업소서 닷새 만에 염소가스 5kg 누출(종합),"[날씨] 절기 춘분, 종일 '쌀쌀'…동해안 대설경보","볼보코리아, 강남 대치 전시장 확장 이전…서비스센터도 열어",레슬링 해설 '빠떼루아저씨' 김영준 전 경기대 교수 별세,"아세안의 향(香)을 본다'…아세안문화원, 현대미술전 개최",[게시판] BBQ. 베트남 하노이에 첫 배달 전문점 개점,"한은 ""물가 상승은 유가·호우 영향…다시 둔화할 것""","아모레퍼시픽, '레드닷 디자인 어워드' 3개 본상 수상","[특징주] HPSP, 최대주주 지분매각 소식에 13% 급등","코스피, 장 초반 하락해 2,540대 후퇴…코스닥도 내려(종합)"
"경기도, '안전예방 핫라인' 통해 작년 324건 안전점검","[게시판] 식약처, 올해 규제지원 사업 담은 '셀업 캘린더' 공개","방심위, K-콘텐츠 불법 유통 사이트 6천여 건 접속 차단",[진천소식] 진천·음성 공유평생학습관 4월 개관…7개 학습실 갖춰,"장수군 농특산물 온라인 쇼핑몰, 고객에 사은품 증정 이벤트","경비원 살해 시도 전날 전처 살해한 70대 ""우발적 범행""","삼성전자 한종희 ""AI·고객경험·ESG 혁신…신사업 발굴 강화""",경기 구리에 건조주의보…광주에 건조주의보 유지,"""날 해치려고 했다"" 망상…어머니에게 흉기 휘두른 아들",경기 서부권 7개 시 연결 광역시티투어버스 운영 개시,"관악구, 유니세프 '아동친화도시 상위단계 인증' 획득","충주거점산지유통센터, 전국 경영평가서 2년 연속 1위","코바코, 방송인 강남 출연 '다문화 이웃들' 공익광고 송출","검찰, '김정숙 여사 타지마할 출장 수행' 前주인도대사 소환",[그래픽] 서울 신축·구축 아파트 가격차 추이
"[게시판] 김제영 백석대 교수, 한국미래춤협회 이사장 취임",올해부터 공주시 중3 학생에 국외체험비 지원…1인당 130만원,"EPL 에버턴, 승점 삭감 10→6점으로 감경…강등권 탈출","코스피, 매물 소화하며 2,630선 공방…코스닥 급반등(종합)",[파주소식] 서울-문산 고속도로 '금촌 나들목 진입로' 확장,"해양진흥공사·KMI, 2024년 정책개발 협력회의","[게시판] 보훈부, 서해수호 55용사 유가족에 청소기 지원",[제주소식] 농가사료 직거래 활성화 지원 사업,"[게시판] 산업부·코트라, '한-이집트 제조업 파트너십' 행사 개최",공주·부여·익산서 느끼는 백제…27일부터 '백제문화유산주간',옛날 앨범도 잘팔리네…세븐틴 연간 음반 1천만장 판매 도전,"日닛케이지수, 美증시 큰폭 하락에 장중 5% 급락…37,000선 붕괴","美 민주-공화 경합주 동시 공략…트럼프 ""토론 붙자""",면역항암제 안 듣는 난치성 뇌종양 치료 가능성 열었다,"추경호 ""野 '김여사 특검법' 강행처리하면 즉시 재의요구 건의"""
"인천항만공사 사장 ""올해 물동량 역대 최대 350만TEU 목표""","中왕이, 캐나다에도 ""대만 독립세력에 잘못된 신호 보내지 말라""","벤츠코리아, 현대작가 '필립 파레노' 리움미술관 전시 후원","전남도, 중기취업 청년 학자금 대출 상환 지원","롯데바이오, 분기별 신입·경력 공채…""올해 세 자릿수 채용""",[게시판] 한국음악레이블산업협회 윤동환 회장 연임,"[게시판] 딜라이브, 수도권 47개 선거구 개표상황 방송",기재부 '경제정책 위키피디아' 출범 2개월…240건 등록,"한총리 ""세종대왕 위민정치 받들어 민생·미래 개혁에 온 힘""","[게시판] 국가연구개발 수행인력 연구윤리 교육, 21일 운영 개시","개그맨, 음주운전 사고…가드레일 들이받고 차량 전복(종합)","고양시, 원당·일산 전통시장에 '냉방 장치'","[특징주] 삼성전자 등 반도체주, 미국 기술주 약세에 일제히 하락","HDC현산, '서울원' 비전 선포…""도시의 새로운 상징될 것""","권익위, 부패방지 분야 전문 학술지 '권익' 창간호 발간"
내리막길 굴러온 음주 차량…시민이 뛰어들어 사고 막아,"ㅍㅌㄴ', '펜_타_닐'로 검색해도 인공지능이 잡아낸다",제13회 이태석기념음악회 내달 23일 부산문화회관서 개최,애플 전기차 포기에 테슬라 등 차 업계가 '안도'하는 이유,"안산시, 옛 모습 담긴 사진 공개 모집…최대 5만원 상품권 지급","대구서 또 노후 김치냉장고 화재…""반드시 리콜 받아야""","현대백화점 10개 상장사, 주총서 정관 개정…""배당기준일 변경""",소상공인에 스마트기술 빨리 보급하도록 지원절차 재정비,"산업부, 신기술 연구개발 지원 '샛별 프로젝트' 추진","삼립, 건강빵 브랜드 '프로젝트:H' 출시",[게시판] 컴투스플랫폼·헥슬란트 웹3 콘텐츠 사업 개발 협약,"""이름도 없이 법에 없는 업무 해와…전담간호사 보호법 필요""","러시아 ""우크라, 1천 명으로 본토 공격했지만 저지""","해양산업클러스터, 서울서 탄소중립 전략세미나",침몰' 금성호 실종자 시신 추가 인양…사망자 4명으로
"[게시판] 부동산R114-핀다, 대출·중개 활성화 '맞손'","미 10년물 국채 수익률 하락…""CPI가 금리인하 기대 못꺾어""","""생활인구 100만명 향해""…보령시 올해 인구정책에 958억원 투입","시흥시, 은계지구에 영상미디어센터 건립…2026년 2월 준공","전공의 행정처분 본격 착수…정부 ""예외 없어""","도로시설물부터 옥외광고물까지…종로구, 해빙기 안전점검","NH농협은행, 창원시에 제휴카드 적립기금 1억2천만원 기탁","파리 찾은 유인촌 ""코리아시즌 개막…韓, 문화 올림피아드 동참""",軍 야전 작전용 '소리 없는 수소 발전기' 개발한다,"김현기 서울시의회 의장, 튀르키예 앙카라·이스탄불 방문","천안시, 스마트도시 이어 '천안역세권 투자선도지구' 선정",대전서 로봇융합페스티벌 등 로봇 관련 행사 잇따라 열려,"[게시판] iM라이프, 연금지급 기능 강화한 변액보험 출시",명태균 의혹' 수사 지휘 이지형 차장검사 출근…수사 속도낼 듯,"""이런 자산이 있었네?"" 미수령 주식 찾기, 누적 실적 1조원 넘겨"
"[인천소식] 해경청, 해양범죄 피해자 보호기금 첫 운용",한국타이어 후원' 포뮬러E 시즌10 개막…멕시코시티서 첫 경기,"두산연강재단, 올해 초중고생·대학생에 장학금 29억원 지원","선수에게 '강제 출국' 명령한 벨라루스 육상 코치, 5년 자격정지","사천서 일산화탄소 중독 일가족 4명, 경찰·소방·이웃이 살려","삼성생명, 외국인 고객에 모국어로 보험 정보 제공한다","스트레이 키즈, 8월 美 롤라팔루자 헤드라이너로 출연","LG전자, 어린이날 맞아 장애아동과 '작은 운동회'","통상본부장 ""알루미늄 압출재 반덤핑, 최종까지 대미협의""","[특징주] 신약승인 불발 패닉 지속…HLB, 연이틀 하한가",펀드 계좌수 1위' 카카오페이증권 신규 펀드 14종 추가,구리시도 기후동행카드 쓴다…수도권 동북부 교통편의 강화,원주서 오토바이·승용차 충돌…1명 숨져,[용인소식] 동절기 대비 저소득층 162가구에 전기요 지원,사흘 앞으로 다가온 수능…문제지·답안지 배부 시작
"천안시, 올해 7대 전략과제·634건 주요 업무 추진","용산구, 봉제원단조각 전용 봉투로 무상 수거한다","NHN, '다키스트 데이즈' 1차 비공개 베타테스트 참가자 모집",영암서 작업자 추락사고 잇달아…2명 부상,"OPEC+, 6월말까지 감산 연장…잠잠하던 유가 더 오르나","한국교통안전공단, 내달 김천드론자격센터서 첫 드론 실기시험","코스피, 美증시 반등에 2,670대 회복…코스닥 강보합(종합)","한은 총재 ""4월 통방, 5월 통방의 근거 못 돼""…사실상 '원점'","20일부터 한 달간 불법車 일제단속…""안전신문고로 신고 가능""","신세계면세점 명동점, 몽블랑 부티크 재단장",인천뮤지엄파크 내년 상반기 착공…2028년 개관 목표,"교육부, 전문가들과 '글로벌 교육·인재 전략위원회' 워크숍","한미 우호 요람' 주미대한제국공사관, 미국의 국립사적지 된다","기아, 인증 중고차 케어 서비스 '리멤버스' 출시","서부발전, 중소기업 동반성장 혁신대상 수상"
충주 등 충북 7곳 한파주의보 해제,이재명 피습때 입었던 셔츠 옷깃에 구멍 뚜렷…폐기 직전 수거,"전공의 1만명 집단 사직…""29일 마지노선""","경주·포항서도 샛별배송…컬리, '전국 컬세권' 구축 박차","프로축구연맹, 방송사업팀 경력사원 공개 채용","11번가, AI 추천 강화 패션 전문관 '#오오티디' 오픈","하이트진로 테라 5주년, 누적판매 45억4천만병…초당 29병 팔려",HD현대오일뱅크 주유소에 고압수 사용 세차기 확대 설치,"농관원-배민, 농식품 원산지 표시 교육영상 제작","상업지역 비주거비율 완화…영등포구, 주택공급 확대 기대","오세훈 ""이재명 '기본사회'는 반(反)청년…파국 예정된 복지""",거제·통영·거창·남해 경남 4곳 폭염경보,"태국 헌재, 제1당 해산…지도부 10년간 정치활동 금지","코스피, 美대선 경계 속 강보합 2,570대…코스닥 상승(종합)","조계종 종정 ""정진, 전쟁 그치게 하고 지구촌 청정하게 할 것"""
"경기교육청, 대안교육 위탁기관 24곳 운영","이낙연, 이준석에 ""함께 해야…세대통합 모델 될 수도""","3쿠션 달인' 이충복, 프로 무대 첫 시즌 9전 전패로 마감",남해고속도로 제2지선 가락 나들목서 다중추돌…2명 숨져,"바이든 인지력 문제삼더니…트럼프, 바이든·오바마 혼동","아이파크몰, 야외 공간서 콘서트 확대…문화·공연 활동 후원","SK하이닉스, 엔비디아 GTC서 AI PC용 고성능 SSD 신제품 공개","[게시판] 무신사, 자립준비청년·아동양육시설에 후원금","강원 마을기업 3곳, 행안부 '우수·모두애(愛)' 부문 선정","이지스자산운용, 센터필드 미디어월 영상 콘텐츠 공모전",방문진 이사에 김성근·엄기영·허익범 등 32명 지원,"예산군, 젖소 농가에 환풍시설·원유냉각기 등 지원",미래에셋증권 2분기 영업이익 2천733억원…작년 대비 74.4%↑,"충남도, 어린이·청소년 대상 '충남 방문의 해' 그림 공모","하이트진로, '캐시아드 빈야드' 와인 2종 국내 최초 선봬"
