1월 8일,1월 12일,2월 27일,2월 28일,3월 4일,3월 19일,3월 20일,5월 3일,5월 15일,5월 20일,7월 15일,8월 2일,8월 8일,11월 6일,11월 11일
"EU상임의장, 유럽의회 선거 출마…당선시 조기사임·공백 예상(종합)","러, 우크라군 훈련 지원 계획 몰도바에 강한 반발","젤렌스키 ""트럼프는 푸틴이 멈추지 않을 것임을 모른다""",나발니 지지자들 '대선일 시위' 촉구…크렘린궁 '불법' 경고,한미 '자유의방패' 연습 오늘 시작…야외기동훈련 작년의 2배,[알림] 연합뉴스 콘텐츠 저작권 고지,철원 등 강원 5곳 대설주의보…횡성 등 9곳 대설주의보 유지,스위스 '우크라 평화회의' 각국 160명 초청…러 일단 제외,"[사이테크+] ""2023년 북반구 여름, 과거 2천년 사이 가장 무더웠다""",90세 美 전직파일럿 태운 블루오리진 우주선 발사…사고 2년만(종합),음주운전하다 고가교서 차량 추락…도주한 운전자 검거(종합),"눈물 흘린 삐약이' 신유빈, 단식 준결승 진출","뉴욕증시, 폭락장에서 한걸음 더 벗어나…이틀째 반등 출발","美 ""북한군 1만명 쿠르스크 이동""…우크라 ""소규모 교전""(종합2보)","독일 시몬 에델만, 국립심포니 국제지휘콩쿠르 우승"
"바이든, 3월7일 美의회 국정연설…트럼프와 차별화에 초점 전망","[르포] ""라이칭더 둥쏸(凍蒜)!"" 울려퍼진 타이베이 총통부 앞 거리",고교생에 곤봉 세례…伊 '팔 지지 시위' 강경 진압 논란,"뉴욕증시, 주요 지표 앞두고 혼조세로 출발","패배' 앞둔 헤일리, 트럼프 지지선언 안하나…질문에 답변 회피","보훈부 ""육사 홍범도 흉상 독립기념관 이전, 국방부 요청 없어""","野, '전화홍보방 의혹' 광주북갑 정준호 공천 유지…""후보와 관련성 없어""","유엔 ""가자지구 재건 최대 55조…주택 복구 80년 걸릴수도""(종합)",韓 여성인권 유엔 검증대에…차별금지법·비동의간음죄 쟁점,"손흥민, EPL 최종전서 통산 3번째 10골-10도움 달성",[美공화 전대 D-1] 철제 펜스로 둘러싸인 행사장…총격 후 경계강화에 긴장 고조,배드민턴 남녀 복식조 3팀 모두 8강전서 탈락 고배,올 상반기 자연재해로 전세계 165조원 경제손실,"무노조' 테슬라, 독일공장 직원 임금 4％ 인상","러 쇼이구, 11∼14일 방중…왕이와 전략안보 회담"
"알자지라 지국장, 이스라엘 공격에 아내·딸 이어 아들도 잃어","스위스, '러 동결자산 우크라 지원' 놓고 상하원 이견",출구 없는 민주당 공천 갈등…지지율도 역전,"美대선서 불법이민 이슈 부상 가속…55% ""미국에 중대 위협""","""OPEC+, 자발적 원유 감산 2분기까지 연장""",전술지대지유도무기 첫 전력화…北핵사용 가상 한미 범정부 연습,"IOC 위원장 ""'올림픽 휴전' 바라지만 정치적 중립 지켜야""",유대회당 테러 배후' 독일 조폭 이란서 의문의 피살,"파월 의장 ""美 인플레 지표 다시 둔화할 것으로 기대""(종합)","바이든, 반전시위 가운데 흑인대학 졸업식…""평화시위 지지""","[트럼프 피격] 멜라니아 ""괴물이 남편 공격""…총격 사건 하루 뒤 성명","[올림픽] 신유빈, 한국 탁구 20년 만의 단식 4강 진출…한일전 승리(종합2보)","[올림픽] 김수지, 한국 여자 다이빙 최초 2회 연속 준결승…3ｍ 예선 11위",파주 숙박업소에서 50대 여성 숨진채 발견…경찰수사,서산서 운전자 살해 후 차량 불태우고 달아난 40대 체포(종합)
"WSJ, 일론 머스크 마약 복용 의혹 제기…머스크는 부인",트럼프 자산부풀리기 의혹' 재판장에 공판 앞두고 폭탄 협박,"스페인 세비야, 랜드마크 광장에 관광세 도입 추진","美 옐런, 러 동결자산으로 우크라 지원 촉구…""필요하고 시급해""","하마스, 휴전 협상차 카이로 도착…이스라엘은 파견 보류(종합)",테러리스트와 연대?…구속된 독일 적군파 지지시위,"영 김 ""대만갈등시 韓, 北 위협 직면…한미일 삼각 공조 중요""","美 ""러, 3월 정제유 16만5천 배럴 北에 제공…공급 지속 전망""(종합)","뉴욕증시, 예상웃돈 PPI에도 파월 발언·밈주식 기대에 상승 출발","블루오리진, 2년만에 우주비행 성공…90세 前파일럿 최고령 탑승(종합2보)","알카라스, 조코비치 꺾고 윔블던 테니스 대회 2년 연속 우승",네덜란드서 '늑대 주의보'…어린이·반려견 물려,"""회사채는 잠잠하네"" 투자자들, 美 회사채 발행 지속에 '안심'","이란, 테러 혐의 독일인 '사형 집행' 사실상 번복","이스라엘군, 다마스쿠스 남쪽 공습…""3명 사망"""
"멕시코 마약 조직, 주도권 다툼에 '공격용 드론'까지 동원","뉴욕증시, 예상보다 강한 12월 물가에 하락세로 출발","WP ""바이든, 中에 민감한 개인정보 판매금지 행정명령 서명예정""","꺼지지 않는 파병론…佛 ""우크라서 지뢰제거 등 가능""","""경기호전"" 답변 美 유권자 늘었는데…혜택 못받는 바이든",황상무·이종섭 논란'에 비례 공천까지…당정 갈등 재연 우려(종합2보),"나발니 부인 ""푸틴, 합법적 대통령 인정 못받게 할 것""",유로비전 참가 이스라엘 가수에 '외출자제'…중동분쟁 불똥,악어와 맨주먹 사투로 자매 구한 英여성 '용감한 시민상',"美·유럽, 이란 대통령 헬기 사고에 촉각…""주시하고 있다""","쿠웨이트 ""3년치 산유량 맞먹는 석유·가스 발견""","뉴욕증시, 비둘기 파월·빅테크 호실적 가린 경기 우려…하락 출발","[올림픽] 태권도 박태준, 세계 1위 꺾고 결승 진출…58㎏급 은메달 확보(종합2보)",미국 대선 투표 진행중…초박빙 접전·예측도 제각각,2025 한국이미지상'에 오상욱·에드워드 리·신유빈
"""협상 가능했다""…美 남북전쟁 놓고 헤일리 이어 트럼프도 구설","트럼프가 해고한 前 FBI국장 ""트럼프 법대로 사법처리해야""","뉴욕증시, 연준 선호 물가 대기하며 상승 출발","美 '중산층 상징' 메이시스 백화점 점포의 30%, 150개 폐쇄","""가자지구 어린이 최소 15명 굶어 죽었다…추가 사망 우려""(종합)",인천 대곡동 가건물서 불…주변 공장 3곳으로 번져,"우크라 ""러, 전쟁 성공하면 유럽·중앙아시아도 공격""","진격 속도 내는 러…""우크라 동부 베르디치 장악""",로만 폴란스키 英여배우 명예훼손 1심 무죄,"손흥민, EPL 최종전서 3번째 10골-10도움 달성…토트넘 유로파행(종합)","[트럼프 피격] 총기 권리 옹호해온 美공화, 총기 공약·정책에 변화?",美맨해튼 빌딩 40분의 1 가격에 매각…상업용 부동산 침체 가속,기약없는 독일경제…수출 급감에 자동차 불황 이중고,[뉴스특보] 미 대선 본투표 진행 중…초박빙 승부·역대급 사전투표,"[트럼프 재집권] 트럼프, 김정은과 친분 과시했지만…""더 위험한 北 마주할것"""
스위스서 성추문 佛국민배우 영화 편성 제외 두고 논란 가열,"바이든 ""물가 잡기 위해 할 일 많아…공화당은 무계획""","엄상필 후보자 ""압수수색 대면 심리·조건부 구속영장 긍정적""(종합)",싱어게인3' 우승 홍이삭 우간다서 팬미팅,호주 매쿼리섬 남쪽 바다서 규모 6.7 지진 발생,"美무당층 3분의 1이상, '트럼프 입막음돈' 유죄시 ""지지 안할것""","프랑스, 공무원 주4일·주별 차등 근무제 도입 검토","""튀르키예, 이스라엘과 교역 전면 중단""","美, 中 전기차 관세 100%로 대폭 인상…中 반발 ""즉각 취소해야""(종합)","맨시티, 사상 첫 EPL 4연패 대업…최종전 승리로 자력 우승",[트럼프 피격] 총격범 차량과 자택서 폭발물도 발견,"美 민주, 해리스 후보 선출 호명투표…인종 정체성 논란 지속","러 총참모장 ""우크라, 1천명으로 본토 공격했지만 저지""","[美대선] 해리스 ""미국인, 분열에 지쳐…우린 공통점 더 많아""",금성호 침몰사고 실종자 추정 시신 1구 추가 발견(종합)
생태 보고 갈라파고스서 불꽃놀이 '펑펑'…담당자 해임,프랑스→벨기에 버스서 '테러동기 의심' 3명 체포,"트럼프, '6천억원 벌금' 사기 대출 1심 판결에 불복해 항소","프랑스 56년만에 교복 등장…""차별 없애"" vs ""군대화"" 논쟁","獨국방, '타우러스 녹취 유출' 파문에 ""푸틴의 정보전 일부""","유엔총장 ""가자주민 110만명 재앙적 굶주림 직면…전쟁 멈춰야""",美 물가통계 정보 '슈퍼유저' 논란…섣불리 보낸 이메일이 단초,"美, 北해커조직 김수키 주의보…""美정부·학계에 이메일피싱""","이스라엘 외무 ""가자 구호 차질은 우리 아닌 이집트 탓""","아르헨 밀레이, 스페인서 유럽 극우 지원유세",암투병' 英왕세자빈 윔블던 결승전서 시상,"네타냐후 ""이스라엘 공격하면 무거운 대가 치를 것""","[올림픽] '세계 1위' 젠두비 압도한 태권도 박태준 ""지금까지는 전략대로""",美 9월 무역적자 844억달러…2년5개월만에 최대 규모,암스테르담 '이 축구팬 폭력사태' 여진…팔 지지 시위대 체포
"美국민 54%, 트럼프 대선후보 자격 박탈 반대…여론분열 극심",[사이테크+] 북미 남부서 티라노사우루스 친척 신종 공룡 화석 발견,"외교2차관 ""北, 핵실험 자랑할만큼 뻔뻔…도발 즉각중단 촉구""",美서 불법입국자의 여대생 살인사건으로 국경통제 논쟁 가열,"라이벌' 전시각료 방미에 뿔난 네타냐후 ""총리는 한명""",런던 외곽 건물에 뱅크시 '나뭇잎 벽화' 등장,남아공 의회의장 뇌물 혐의로 자택 압수수색,"마크롱·기시다, AI 국제기구 설립 문제 논의","美하원의장, 뉴욕법원서 트럼프 지원…""사법, 트럼프 겨눈 무기""",아이티 이웃' 도미니카共 대선…치안강화 열망 속 연임 유력,제주 차귀도 해상서 어선 침수…승선원 10명 전원 대피,나이지리아 곳곳서 '나쁜 통치 종식' 반정부 시위,"튀르키예, '이스라엘 집단학살' ICJ 제소 동참키로","뉴욕증시, 대선일·FOMC D-1…경계감 앞선 기대감에 상승 출발","이스라엘군, 다마스쿠스 남쪽 공습…""7명 사망""(종합)"
"카타르 총리 ""하마스 3인자 사망, 휴전 중재에 영향""","IS, '9명 사망' 시리아 버스 폭탄 테러 배후 자처","[MWC] '알파고 아버지' 허사비스 ""2∼3년 내로 AI가 만든 약 나올것""","러 ""우크라에 유럽군 파병시 러-나토 충돌 불가피""(종합)","스위스, 국민투표로 연금인상 찬성, 정년연장 반대…재원 논란","伊 베테랑 수비수 아체르비, 인종차별 논란으로 대표팀 낙마",베를루스코니 옛 로마 사저에 '눈엣가시' 외신기자협회 입주,"英 공무원 노조, 르완다 정책에 소송…""법적 충돌 우려""","주미대사 ""한미동맹 제도화…美대선결과 관계 없이 강화될 것""","이란 대통령, 헬기 추락으로 실종…외무장관도 동승(종합2보)","베벌리힐스…' 배우 섀넌 도허티, 암투병 끝에 별세…향년 53세","美법원 ""트럼프 '입막은 돈 재판' 함구령 1심 선고일까지 유효""","[올림픽] 다이빙 김수지 ""경기장 오니 안 아파…결승 진출 '할 수 있다'""","[美대선] 공화 부통령 후보 밴스 ""결과 알 수 없지만 느낌 좋다""",침몰 금성호 실종자 추가 시신 발견…60대 한국인 선원(종합2보)
"외통위, 조태열 외교장관 후보 인사청문회",경남 김해 초미세먼지주의보 해제,생태 보고' 갈라파고스 입도 100→200달러…8월부터 적용,멕시코서 시장 예비후보 2명 7시간새 잇따라 피격 사망,"中과 '패권경쟁' 美, AI 무인전투기 개발 본격화…5개사 경쟁","이스라엘군 ""가자지구 최대 병원서 하마스 20명 사살""","탈북민들 ""장마당서 富축적하면 당국 칼날…그래도 없어선 안돼""","바이든, 대학 반전시위에 ""표현 자유 존중하지만 질서 지켜야""","무협회장, 美에 ""구조적 흑자이유로 반덤핑·상계관세 남발안돼""","""MS, 21일 개막하는 개발자 콘퍼런스에서 인공지능PC 비전 공개""","[트럼프 피격] ""총격범, 외국 테러리즘과 연계 흔적 발견 안 돼""","[올림픽] 북한 방철미, 여자 복싱 54㎏급 준결승 진출로 동메달 확보",5천600㎞ 대서양 건넜나…카리브해 선박에 유골 10여구와 마약,"[美대선] 트럼프 ""엄청난 승리 거둬 미국 위대하게 만들 것""",쿠바 만사니요 남남동쪽 해역서 규모 6.8 지진 발생
"의회난입' 수감자 놓고 트럼프 ""풀어줘야""·펜스 ""법대로 처벌""","[현장잇슈] 모르고 탔는데 의자 없는 칸…""노약자는?"" VS ""오히려 좋아""","스웨덴, 나토 32번째 회원국된다…헝가리, 비준안 가결(종합)","친러' 슬로바키아·헝가리 ""무기 지원보다 협상 우선""",인천 강화 초미세먼지주의보 해제…영종·영흥권 주의보 유지,바이든 국정연설 효과?…트럼프와 전국 단위 조사서 '박빙 대결',매카시 前하원의장이 비서실장?…트럼프 '차기내각' 하마평 분분,"브라질 남부 폭우에 45명 사망·실종…""전시상황 같다""",노벨문학상 수상 캐나다 작가 앨리스 먼로 별세…향년 92세,브라질 상파울루 최대 문화 축제에서 태권도·K팝 댄스 인기몰이,"베벌리힐스…' 배우 섀넌 도허티, 암투병 끝에 별세…향년 53세(종합)",英 팬데믹 후 첫 금리 인하…추가 인하 계속될까,덴마크 총리 폭행범에 징역 4개월…6년간 입국 금지,"러 ""한국과 관계, 우리가 먼저 망치지 않았다""",비트코인 사상 첫 8만달러 돌파…가상화폐 급등세 지속(종합)
"美 항공청 ""안전확인 때까지 보잉 737-맥스9 전면 운항 금지""",가지지구서 적신월사 구급차 공습…대원·환자 6명 숨져,독일 대중교통 '파업주간'…내달 1일 대부분 운행중단,"이탈리아, 中전기차업체 비야디 접촉 ""공장 지어달라""","대선 재대결 확정 앞둔 트럼프, 바이든에 우세…CBS 52% 對 48%(종합)","트럼프측 ""6천억원대 재판 공탁금 마련 불가능"" 법원에 호소","스페이스X ""위성 인터넷 부품 판매 계획…기업공개는 아직""","네타냐후 ""승리를 위해 라파 공격 등 할일 할 것""","적십자 '지상전 임박' 라파에 야전병원…""환자 급증 대응""","머스크 뇌신경과학 스타트업 ""두번째 컴퓨터칩 이식신청자 모집""","[트럼프 피격] ""총격범, 평범한 중산층 출신…가족들 정치 성향 혼재""","[올림픽] 여자 양궁 '맏언니' 전훈영, 개인전 16강 진출","英, 폭력시위자 '고속 재판'…20∼36개월 징역형 선고",한·오스트리아 필하모닉 공연…25년째 정기연주회,"[트럼프 재집권] 측근들 ""정적리스트 없다…최우선 과제는 통합"""
내륙 곳곳 아침 기온 영하 10도 이하…낮에도 -1∼6도 그쳐,"美전문가 ""北, 러와 탄약 공동생산하고 러에 노동자 보낼 수도""","나발니 장례식은 언제, 어떻게…추측만 분분","젤렌스키, 사우디 방문…빈살만 왕세자와 포로송환 등 협의","머스크 75조원 보상 무효' 이끈 로펌, 테슬라 주식 8조원 요구","EU 상임의장 ""평화 원하면 전쟁 대비해야""…국방 강화 촉구","찰스3세, 6·25 참전용사 초청…""한국전 기억하겠다""","英 대학도 텐트 시위 확산…정부 ""反유대 폭력행위는 엄단""(종합)","러 ""푸틴·시진핑, 비공식 회담서 중요 외교현안 논의""",슬로바키아 총리 총격 공범 수사…범인 SNS 체포뒤 삭제돼,"바이든 ""피격사건, 독립적 조사 지시…결과 나오면 국민과 공유""",[올림픽] '마른하늘에 번개'…안병훈의 다사다난했던 1R 마지막 홀,독일서 17세기 지은 호텔 건물 붕괴 2명 사망(종합),"유엔 13개 회원국, 北 ICBM 규탄 성명…안보리 차원 성명은 못내","[트럼프 재집권] ""美연준, 대통령 지시받아야"" 주장에 머스크, '100점' 지지 표시"
"오늘 서울 -9도, 살을 에는 듯한 추위…곳곳 한파 특보",바티칸 성베드로 대성전 '걸작' 발다키노 10개월간 복원,"이스라엘군, 가자지구 중-북부 잇는 10㎞ 땅굴 발견",유럽의회서 '자연 복원법' 가결…우파 폐기 시도 무산,"오늘부터 전공의 면허정지·처벌 절차 개시…""구제 없다""","美관리 ""北, 극초음속미사일 등 무기 개발·실험…매우 우려""","푸틴 ""친우크라 무장세력은 쓰레기…시효없이 처벌""(종합)","美 ""러, 올해 北에 50만배럴 넘는 정제유 제공""…제재 무력화(종합2보)","20대 청년 해친 伊 살인곰, 사살 대신 獨 보호구역으로",77세 트럼프도 '30초 얼음'?…연설 도중 돌연 말 멈추고 침묵,"[트럼프 피격] ""50대 의용소방대장, 가족 지키려 몸 던져""",권도형 운명' 가른 몬테네그로 개각…법무장관 교체로 반전,"[올림픽] 여자골프 양희영, 1R 공동 13위…고진영·김효주 오버파 중위권","[美대선] 트럼프, 부인과 함께 플로리다서 투표 ""대승 자신""","비트코인, 사상 첫 8만달러 돌파 후 8만1천달러도 넘어(종합2보)"
"북, 사흘 포사격에 탐지능력 비하…군 ""저급한 선동""",헤일리 뉴햄프셔서 트럼프 꺾나…反트럼프 후보사퇴에 판세 출렁,美공화 전국위원회 의장 내달 사임…트럼프 당 장악 마침표,트럼프 이어 바이든도 내달 운수노조 면담…노동자 공략 가속,"한동훈, 천안서 총선 격전지 순회 시작…대학·시장 방문","""MS-오픈AI 잡자""…스마트폰 라이벌 구글-애플, AI로 오월동주?","EU, 러 동결자산 수익 활용처 '재건→무기지원' 급선회(종합)","바이든, 대학 반전시위에 ""표현 자유 존중하지만 질서 지켜야""(종합)","美 ""외교제안에 北, 미사일로 화답…美, 韓日과 안보협력 강화""",아르헨티나 한국문화원 '찾아가는 문화원' 비에드마에서 개최,"트럼프 ""오늘 전대 개최지 밀워키로…총격범이 계획 변경 못해""","""가로등 밑 어두운 부분까지""…WHO, 감염병 연구범위 확대 촉구","[올림픽] 샤이니 민호 ""올림픽, 전 세계인의 융화의 장""",에르도안 '집권 연장' 시동거나…튀르키예 범여권서 개헌론,"美 ""김정은, 파병대가로 러의 핵프로그램 기술지원 기대 가능성"""
"북 ""88발 포사격…위협 조성 없는 정상 훈련""",美서 비트코인 현물ETF 거래개시…블랙록·그레이스케일 '두각',"우크라, 격전지서 후퇴 거듭…러 ""美 에이브럼스 탱크 파괴""",혁명가에서 강도로 전락…獨 '적군파' 조직원 체포(종합),"민주 탈당한 김영주 국회부의장, 국민의힘 입당식","찰스 3세 서거' 가짜뉴스 소동…英 해외공관들 ""거짓""","올해 뎅기열 심상찮다…브라질, 벌써 역대 최다 감염","백악관, '외국인 혐오하는 일본' 바이든 발언 해명하느라 진땀","페루 산길서 또 버스 전복 사고…""13명 사망·14명 부상""",88세 사우디 국왕 폐렴 진단받아…치료 예정,[美공화 전대 D-1] 행사장에 철제 펜스 설치…총격 후 경계강화·긴장고조(종합),"美 ""북중러 핵무기 계속 늘리면 美 핵무기 더 배치해야 할 수도""","WHO, 엠폭스 확산에 보건비상사태 재선언 검토…전문가 소집","[美대선] 가상화폐 비트코인, 4일 만에 7만달러선 회복","국회 예결위, 이틀 동안 경제부처 예산안 심사"
"여, 교총회장·학폭변호사 영입…이상민도 입당 결정",남아공은 왜 이스라엘을 국제법정에 제소했나,러 모스크바·레닌그라드 군관구 부활…나토 확장에 대응,"바이든, 의회에 예산안 처리 호소…""셧다운 막고 우크라 도와야""","이준석, 화성을 출마 선언…'반도체 벨트' 구축 목표","14시간 정전' 쿠바서 정부 성토 시위…대통령 ""美 제재 탓""","北억류 선교사 아들 ""부친 생사를 모르는게 제일 힘듭니다""","""구글, 아이폰 기본검색 설정되려고 2022년에 200억달러 지급""","코언 ""대신 낸 입막음 돈 받으려 트럼프그룹에 가짜청구서 보내""",의대 증원' 최종 확정 임박했는데…전공의 복귀는 '아직',"[트럼프 피격] ""50대 의용소방대장, 가족 지키려 몸던져…영웅으로 숨졌다""(종합)","페이스북 모회사 메타 주가 6% 상승…""AI 투자로 성과""","경기침체 판단 '삼법칙' 개발자 ""연준 긴급인하 불필요""",트럼프에 올인' 머스크의 테슬라…美 대선일 주가 장중 4%대↑,"여야의정 협의체, 野없이 일단 출범…국회서 첫 회의"
다방 연쇄살인 피의자 구속…신상공개도 검토,"美언론 ""美 국방부, '장관 깜깜이 입원' 논란에 감찰 방침""",주튀르키예한국문화원 '골든벨을 울려라' 한국 지식 경연대회,브라질 리우서 경찰과 범죄조직 총격전…범죄 조직원 7명 사망,美대법 '트럼프 대선출마 자격' 슈퍼화요일 하루前 4일 선고할듯,"폴크스바겐 美공장 노동자, 전미자동차노조 가입투표",강원 강릉에 대설주의보…횡성 등 14곳 대설주의보 유지,"나토 ""러시아 하이브리드 활동 증가""…이례적 경고 성명","튀르키예, 2016년 쿠데타 배후 '페토' 544명 체포",선거 2주 앞 멕시코서 정당인 피격 빈발…나흘새 16명 사망,"[트럼프 피격] ""증오의 언행 줄이자""…美 정치권 자성 목소리(종합)","[올림픽] 자유형 200ｍ 챔피언 포포비치 ""내 친구 황선우, 고개 들기를""",[올림픽] '북아프리카 영웅' 된 여자 복서 칼리프…알제리 대통령 찬사,"[美대선] EU정상들, 7일 헝가리서 '공통된' 대미 메시지 조율 시도","與, 尹정부 전반기 국정성과 보고·토론회 개최"
평창서 스키장 곤돌라 멈춰 60여명 고립…정전 사고도 잇따라,"젤렌스키 ""러시아, 북한서 탄약 100만발 받아""(종합)",팔레스타인 자치정부 개혁 압박 속 내각 일괄 사의 표명(종합),"美 ""우크라에 파병 안 해"" 기존 입장 확인하며 파병에 선 그어","對中경쟁·비용압박 美 AI무인전투기 개발박차…""2개사 곧 선정""(종합)",EU 핵심원자재법 제정…2030년까지 제3국산 비중 65% 미만 목표,유럽서 '일회용 전자담배' 판매금지 확산…미성년자에 노출 심각,"美 ""한·일 등과 협력해 북러 겨냥 신규제재 이달 발표""",단편소설 대가' 노벨문학상 앨리스 먼로 별세…향년 92세(종합),전국 대체로 맑고 일교차 커…수도권 오전 한때 비,수련병원들 오늘 전공의 사직 최종 처리…복귀 움직임 아직 미미,"[올림픽] '양궁 여자단체 10연패' 전훈영 ""엄마 축하 카톡에 눈물 주르륵""","[올림픽] '8년 전 4위' 양희영 ""메달 욕심 있지만, 일단 생각 내려놔야죠""","[美대선] 멕시코 대통령 ""당선인 누구든 좋은 관계 맺을 것""","이재명, 경총 방문해 재계 건의사항 청취"
차량 들이받고 음주측정 거부한 40대 가수 겸 배우 입건,"암 투병 에릭손 감독 ""길면 1년 남아…긍정적으로 지내려 해""","스웨덴, 200년 중립→서방 동맹으로…나토 '발트해 포위' 완성",달 착륙 美우주선 곧 멈춘다…예상작동시간 최대 9→5일로 단축,인천 영종·영흥권 초미세먼지주의보 해제,"브라질 중남부, 열돔현상으로 폭염…체감온도 무려 62.3℃","IOC ""러·벨라루스 선수, 파리올림픽 개막식 행진서 배제""",세르비아 새정부 출범…내각에 美 제재받는 친러 인사 2명,"잇단 주한미군 관련 발언에 정부, 트럼프측에 한국 입장 전달(종합)","김호중, 열흘 만에 음주운전 시인…""크게 후회·반성""","與 대표·최고위원 후보들, 천안서 충청권 합동연설회","아르헨 대사관에 왜 브라질 국기가…""베네수 野인사 보호 협력""","산업장관 ""한미 원전분쟁, 정부지원 가능한 협력체계 美와 논의""","인권단체들 北대사관에 모여 서한 전달…""유엔 권고 이행하라""","[트럼프 재집권] 트럼프, 푸틴과 통화…유럽내 미군 거론하며 ""우크라 확전 말라"""
